{
  "schemaVersion": "2.0",
  "id": "roland_aira_demora",
  "aliases": [
    "roland-aira-demora"
  ],
  "displayName": "Roland AIRA Demora Modular (SysEx)",
  "description": "High-Resolution Modular Delay Unit",
  "deviceType": "AUTOMATED_SYSEX",
  "brand": "Roland",
  "brandLogo": "brands/roland-logo.svg",
  "modelImage": "models/roland-demora.webp",
  "midiIdentification": {
    "manufacturer": "Roland",
    "manufacturerIdHex": "41",
    "model": "Demora",
    "modelIdHex": "16",
    "sysexHeaderHex": "41 10 00 00 00 16",
    "autoDetectSysEx": "F0 7E 10 06 01 F7",
    "portNameMatches": [
      "DEMORA",
      "Demora",
      "AIRA"
    ]
  },
  "lifecycle": {
    "preSessionSetup": [
      {
        "description": "Reset Dry/Wet to 100% Processed",
        "method": "MIDI_CC",
        "cc": 15,
        "value": 1,
        "settlingDelayMs": 30
      },
      {
        "description": "Reset Master Volume to Unity (0.75)",
        "method": "MIDI_CC",
        "cc": 16,
        "value": 0.75,
        "settlingDelayMs": 30
      }
    ]
  },
  "functions": [
    {
      "id": "delay_main",
      "name": "High-Res Modular Delay",
      "blockType": "TimeDynamic",
      "suggestedStimulus": "LOG_SINE_SWEEP",
      "routingGuide": {
        "stimulusOutput": "Salida Audio 1 (L) -> Hardware Input L",
        "responseInput": "Hardware Output L -> Entrada Audio 1 (L)",
        "notes": "Muestreo del buffer de retardo, realimentación y filtrado de repetición."
      },
      "controls": [
        {
          "index": 1,
          "name": "Delay Time (GRF 1)",
          "type": "Knob",
          "controlMethod": "SYSEX",
          "sysexAddress": "10 00 00 01",
          "cc": 11,
          "min": 0,
          "max": 1,
          "default": 0.3,
          "unit": "ms"
        },
        {
          "index": 2,
          "name": "Feedback (GRF 2)",
          "type": "Knob",
          "controlMethod": "SYSEX",
          "sysexAddress": "10 00 00 02",
          "cc": 12,
          "min": 0,
          "max": 1,
          "default": 0.4,
          "unit": "%"
        },
        {
          "index": 3,
          "name": "Modulation (GRF 3)",
          "type": "Knob",
          "controlMethod": "SYSEX",
          "sysexAddress": "10 00 00 03",
          "cc": 13,
          "min": 0,
          "max": 1,
          "default": 0,
          "unit": "Depth"
        },
        {
          "index": 4,
          "name": "Color Filter (GRF 4)",
          "type": "Knob",
          "controlMethod": "SYSEX",
          "sysexAddress": "10 00 00 04",
          "cc": 14,
          "min": 0,
          "max": 1,
          "default": 0.8,
          "unit": "Hz"
        },
        {
          "index": 5,
          "name": "Dry/Wet (GRF 5)",
          "type": "Knob",
          "controlMethod": "SYSEX",
          "sysexAddress": "10 00 00 05",
          "cc": 15,
          "min": 0,
          "max": 1,
          "default": 0.5,
          "unit": "%"
        },
        {
          "index": 6,
          "name": "Master Output (GRF 6)",
          "type": "Knob",
          "controlMethod": "SYSEX",
          "sysexAddress": "10 00 00 06",
          "cc": 16,
          "min": 0,
          "max": 1,
          "default": 0.75,
          "unit": "dB"
        }
      ]
    }
  ],
  "bankManagement": {
    "bankCapacity": 1,
    "banksCount": 1,
    "programsPerBank": 1,
    "patchDataSize": 302,
    "patchNameMaxLength": 0,
    "categories": [
      "Delay",
      "Buffer",
      "Custom"
    ],
    "defaultCategory": "Custom",
    "addressingFormat": "PRESET_ONLY",
    "compatibleModels": [
      "roland-aira-bitrazer",
      "roland-aira-torcido",
      "roland-aira-scooper"
    ],
    "sysexProtocol": {
      "manufacturerIdHex": "41",
      "modelIdByteHex": "17",
      "modelIdByteMultiHex": "00 00 00",
      "checksumAlgorithm": "ROLAND_7BIT",
      "encoding": "RAW_7BIT",
      "supportsEditBuffer": true,
      "interMessageDelayMs": 50,
      "midiDefaultChannel": 1,
      "midiDefaultDeviceIdHex": "10"
    }
  }
}
